Name,Handle,Timestamp,Verified,Content,Comments,Retweets,Likes,Analytics,Tags,Mentions,Emojis,Profile Image,Tweet Link,Tweet ID
"Joy, do cartas",@cartasdamaraisa,2024-07-23T16:13:02.000Z,False,"Brasilia tá cada vez mais sem empatia com a questão de prioridade de assentos para idosos, crianças de colo e deficientes em meios de transporte público. Chega a ser feio um jornal mostrar um idoso implorando pra sentar!",0,0,1,151,[],[],[],https://pbs.twimg.com/profile_images/1901759642117500928/v5BRpppE_bigger.jpg,https://x.com/cartasdamaraisa/status/1815782180359983107,tweet_id:1815782180359983107
Agência Brasília,@AgenciaBrasilia,2024-07-23T14:00:01.000Z,False,"#IMPRENSA | 240723_Secretário de Transporte e Mobilidade, Zeno Gonçalves_40 ônibus novos para o transporte público do DF 

Link para download: https://bit.ly/46oPXLJEste pacote contém:

- ⁠Discursos:
-Secretário de Governo do DF, José Humberto Pires de Araújo;

1/3",1,0,0,136,['#IMPRENSA'],[],[],https://pbs.twimg.com/profile_images/1587505169117347840/sjjvwZ7v_bigger.jpg,https://x.com/AgenciaBrasilia/status/1815748708002058285,tweet_id:1815748708002058285
mula cientifica,@fleableh,2024-07-22T22:45:32.000Z,False,indo embora da unb de ônibus com meu amor apenas dois jovens abraçados no transporte publico de brasilia,0,0,3,59,[],[],[],https://pbs.twimg.com/profile_images/1496603426687524873/Yuvo_k4g_bigger.jpg,https://x.com/fleableh/status/1815518569654010090,tweet_id:1815518569654010090
Senhor Nostálgico,@Leo_lemostagua,2024-07-21T14:14:44.000Z,False,"Se não for isso, então é continuar em Brasília trabalhando em padarias, supermercados, restaurantes, lanchonetes; ficar 2 horas no transporte público e fazendo as 48 horas semanais de expediente.",0,0,0,28,[],[],[],https://pbs.twimg.com/profile_images/1471192309475721218/AWXDilkn_bigger.jpg,https://x.com/Leo_lemostagua/status/1815027634008473942,tweet_id:1815027634008473942
Taguá,@taguabsb,2024-07-20T14:57:05.000Z,False,"O problema é financiar um imóvel a 20 Km do seu trabalho, e passar 20 anos nesse vai e vem de carro no engarrafamento, pq o transporte público em Brasília é péssimo.

Ou senão passar 20 anos vivendo como um asceta, mas viver feliz no seu imóvel próprio perto do trabalho.",0,0,2,140,[],[],[],https://pbs.twimg.com/profile_images/1765501831214448640/-rX8CbCh_bigger.jpg,https://x.com/taguabsb/status/1814675906033529079,tweet_id:1814675906033529079
Mila,@Mila8Pixel,2024-07-19T14:17:08.000Z,False,"A vida(estudo, trabalho) em brasilia só acontece no centro, daí a especulação imobiliária dificulta morar mais próxima de lá 
Ler eu até consigo no transporte publico, mas jogar tô deixando só pras férias. Vou tentar assistir bobeiras quando chegar pra desopilar",1,0,0,29,[],[],[],https://pbs.twimg.com/profile_images/1821242889990471680/Od4zcFIE_bigger.jpg,https://x.com/Mila8Pixel/status/1814303463301337206,tweet_id:1814303463301337206
mat,@badgaeriri,2024-07-18T13:04:30.000Z,False,o transporte público de brasília foi longe aqui,0,0,0,15,[],[],[],https://pbs.twimg.com/profile_images/1340717082967740418/0N__S8ne_bigger.jpg,https://x.com/badgaeriri/status/1813922797875327344,tweet_id:1813922797875327344
Cassia Vieira,@cassiavieira22,2024-07-17T21:30:16.000Z,True,"Tarcísio, você é demais. Estamos precisando de um cara igual a você para Governar Brasília. Temos uma Cidade plana, entretanto somente um pequeno trecho tem metrô e o nosso transporte público é uma vergonha.",1,0,1,29,[],[],[],https://pbs.twimg.com/profile_images/1654253824431865858/tRmhamPW_bigger.jpg,https://x.com/cassiavieira22/status/1813687689432207797,tweet_id:1813687689432207797
AℕA MAℝIA,@anamariabsb,2024-07-17T18:43:35.000Z,False,Desde que Brasília é Brasília (ou o DF é DF) nunca houve investimento em transporte público.  É um setor que sempre esteve nas mãos de uns poucos privilegiados e intocáveis.,0,0,4,54,[],[],[],https://pbs.twimg.com/profile_images/1224646296650289158/USSDOh4N_bigger.jpg,https://x.com/anamariabsb/status/1813645742365667543,tweet_id:1813645742365667543
Diário de Ceilândia,@diarioceilandia,2024-07-16T15:45:29.000Z,False,"selos são infalíveis em prever e prevenir incêndios, não é mesmo?

Em Brasília, parece que o transporte público decidiu virar o protagonista de uma saga de incêndios. Quando não é um vagão do metrô que pega fogo, é um ônibus que decide entrar em combustão espontânea. E [+]",1,0,0,138,[],[],[],https://pbs.twimg.com/profile_images/1720962143778906112/PqptY4p7_bigger.jpg,https://x.com/diarioceilandia/status/1813238532124622894,tweet_id:1813238532124622894
Diário de Ceilândia,@diarioceilandia,2024-07-16T15:45:26.000Z,False," Nesta terça-feira (16), em Ceilândia, o transporte público de Brasília decidiu, mais uma vez, inovar no quesito ""emoções fortes"". Um ônibus articulado da empresa Marechal pegou fogo, oferecendo aos passageiros uma experiência inesquecível de adrenalina e caos.

O Corpo de [+]",1,0,2,267,[],[],['\\U0001f4a3'],https://pbs.twimg.com/profile_images/1720962143778906112/PqptY4p7_bigger.jpg,https://x.com/diarioceilandia/status/1813238521286533240,tweet_id:1813238521286533240
queria ser um gato da internet,@nameless_addict,2024-07-16T12:09:49.000Z,False,"Em Brasília o transporte público pega fogo sozinho, não precisa de intervenção de manifestante",0,0,0,46,[],[],[],https://pbs.twimg.com/profile_images/1476347474277187586/3XrMoRge_bigger.jpg,https://x.com/nameless_addict/status/1813184257642405976,tweet_id:1813184257642405976
primo primeiro de cachorro,@srmaylonheberth,2024-07-16T11:33:33.000Z,False,"Primeiro o metrô pega fogo, aí a marechal para não perder seu posto de pior empresa do transporte público de Brasília e segue a tendência, o descaso está cada vez maior, pobre não tem um dia de paz...",0,0,13,879,[],[],[],https://pbs.twimg.com/profile_images/1881732467637268480/Anhnobip_bigger.jpg,https://x.com/srmaylonheberth/status/1813175131763556376,tweet_id:1813175131763556376
mel,@melmskk,2024-07-13T18:16:33.000Z,False,"brasilia de bosta, serve nem pra transporte publico",0,0,1,25,[],[],[],https://pbs.twimg.com/profile_images/1844517121495093254/thPrlxJO_bigger.jpg,https://x.com/melmskk/status/1812189389100908563,tweet_id:1812189389100908563
₣ŘØŦΔ,@frowota,2024-07-13T17:42:45.000Z,False,"É, brasilia já nasceu com essa proposta de afastamento, é tipo a pior parte de se morar em uma RA. Você sente a segregação tanto de transporte público quanto de carro. Os deslocamento vão entre 30mim a 1h40 só de ida. É desgastante e muito rodoviarista, isso afasta",1,0,2,50,[],[],[],https://pbs.twimg.com/profile_images/1898572633358147584/ur4h_jeq_bigger.jpg,https://x.com/frowota/status/1812180879961104460,tweet_id:1812180879961104460
Agência Brasília,@AgenciaBrasilia,2024-07-13T17:00:01.000Z,False,"Passageiros da Colônia Agrícola 26 de Setembro terão mudanças em quatro linhas do transporte público coletivo (965.1, 965.2, 965.3 e 0965) a partir de segunda-feira (15). Mais opções de horários, alterações de itinerários e desativação de linhas. Confira:",0,0,0,118,[],[],[],https://pbs.twimg.com/profile_images/1587505169117347840/sjjvwZ7v_bigger.jpg,https://x.com/AgenciaBrasilia/status/1812170125463740429,tweet_id:1812170125463740429
Blog Meu Transporte,@meutransporte,2024-07-13T12:34:00.000Z,False,Tarifa Zero e eletrificação de ônibus do transporte públicohttps://meutransporte.blogspot.com/2024/07/tarifa-zero-e-eletrificacao-de-onibus.html…#sp #rio #recife #salvador #ceara #manaus #belem #pb #Aracaju #maceio #bh #portoalegre #curitiba #cuiaba #goiania #brasilia #florianopolis #sãoluis #RN #fortaleza #cuiaba #tarifazero #buseletrico,0,0,0,309,"['#sp', '#rio', '#recife', '#salvador', '#ceara', '#manaus', '#belem', '#pb', '#Aracaju', '#maceio', '#bh', '#portoalegre', '#curitiba', '#cuiaba', '#goiania', '#brasilia', '#florianopolis', '#sãoluis', '#RN', '#fortaleza', '#cuiaba', '#tarifazero', '#buseletrico']",[],[],https://pbs.twimg.com/profile_images/1489179938/logomarca_-_C_pia_bigger.jpg,https://x.com/meutransporte/status/1812103181041910007,tweet_id:1812103181041910007
Blog Meu Transporte,@meutransporte,2024-07-13T01:44:56.000Z,False,Subsídio ao transporte público atinge R$ 12 bi por ano e desafia futuros prefeitoshttps://meutransporte.blogspot.com/2024/07/subsidio-ao-transporte-publico-atinge-r.html…#sp #rio #recife #salvador #ceara #manaus #belem #jp #sergipe #maceio #bh #portoalegre #curitiba #cuiaba #goiania #brasilia #florianopolis #RN #fortaleza #cuiaba #antp,0,0,0,245,"['#sp', '#rio', '#recife', '#salvador', '#ceara', '#manaus', '#belem', '#jp', '#sergipe', '#maceio', '#bh', '#portoalegre', '#curitiba', '#cuiaba', '#goiania', '#brasilia', '#florianopolis', '#RN', '#fortaleza', '#cuiaba', '#antp']",[],[],https://pbs.twimg.com/profile_images/1489179938/logomarca_-_C_pia_bigger.jpg,https://x.com/meutransporte/status/1811939837550703046,tweet_id:1811939837550703046
concurseira de esquerda,@leywtff,2024-07-12T14:34:24.000Z,True,O moço do vídeo tem quanto tempo que não anda de transporte público no BR? Pq pelo menos em Brasília tem sim os botões. Te manca zé rosa,0,0,0,26,[],[],[],https://pbs.twimg.com/profile_images/1895577420876414976/wT3DWaoW_bigger.jpg,https://x.com/leywtff/status/1811771094107353402,tweet_id:1811771094107353402
Alano Machado,@alano_Mmachado,2024-07-12T12:06:28.000Z,False,"Uma das maiores empresas de transporte público em Brasília, a Marechal, ainda possui a maioria dos ônibus com cordinhas.",0,0,0,12,[],[],[],https://pbs.twimg.com/profile_images/1441800694919360525/4Bs3H4i9_bigger.png,https://x.com/alano_Mmachado/status/1811733863493713985,tweet_id:1811733863493713985
Marcus Juliaci,@marcusjuliaci84,2024-07-11T16:24:27.000Z,False,Melhorar o transporte público nada né… Brasília cada vez menos amistosa…. Odeio essa cidade…,0,0,1,87,[],[],[],https://pbs.twimg.com/profile_images/1662391288572903424/eql62MOx_bigger.jpg,https://x.com/marcusjuliaci84/status/1811436400874848327,tweet_id:1811436400874848327
Gui Maghreb⛧,@guimarrocos,2024-07-11T12:55:26.000Z,False,"O que o Ibaneiz tá fazendo com Brasília é assustador.

Simplesmente conseguiu destruir a saúde e o transporte público, que não eram nem de longe um dos melhores, mas com certeza hoje é um dos piores.",0,0,0,1,[],[],[],https://pbs.twimg.com/profile_images/1819559740285796353/ewtwAL-D_bigger.jpg,https://x.com/guimarrocos/status/1811383801169240457,tweet_id:1811383801169240457
7\,@juli32bit,2024-07-10T20:11:35.000Z,False,se o transporte publico fosse melhor aki em brasilia eu nao teria vontade de ter carro pq dirigir eh horrivel ,0,0,7,298,[],[],['\\u2764\\ufe0f'],https://pbs.twimg.com/profile_images/1908208288476372992/LPnb7UHy_bigger.jpg,https://x.com/juli32bit/status/1811131171885174961,tweet_id:1811131171885174961
João Abreu,@Janjaojaa,2024-07-10T16:48:49.000Z,False,"Só  vou acrescentar algo: Em Brasília,  o transporte público não aceita mais dinheiro.  É  ilegal, todos fizeram vista grossa...Quem não tem conta em banco e depende de trocados, faz como? Quer maior exclusão que essa? Falei a respeito com a mídia local, ouvidos moucos...",0,0,1,25,[],[],[],https://pbs.twimg.com/profile_images/1680626593272668163/VSLYPkGh_bigger.jpg,https://x.com/Janjaojaa/status/1811080144808800424,tweet_id:1811080144808800424
andrewzin du2,@andrewzenho,2024-07-09T17:28:24.000Z,False,O único jeito de Brasília se redimir de sua configuração carrocentrada era ter o sistema de transporte público mais parrudo e eficiente desse continente do tipo não precisar não ficar 5 minutos numa parada de ônibus e da pra fazer isso sem inventar uma tecnologia nova,0,0,6,73,[],[],[],https://pbs.twimg.com/profile_images/1608500369209933824/USg9guj5_bigger.jpg,https://x.com/andrewzenho/status/1810727719879201047,tweet_id:1810727719879201047
jo,@loserchester_,2024-07-09T14:45:44.000Z,True,"pegando transporte público vazio, tendo cabelo liso, já sendo bonita e usando pouca maquiagem (queria ver ela fazendo isso de 7h no cdu ou de 17h no brasília",1,0,0,34,[],[],[],https://pbs.twimg.com/profile_images/1844222334829318157/Lhs2eigW_bigger.jpg,https://x.com/loserchester_/status/1810686780838121676,tweet_id:1810686780838121676
Yasmin,@yastld,2024-07-09T12:46:29.000Z,False,"Tentei andar de transporte publico sozinha em Brasília pela 1ª vez. Tinha que atravessar a epia pra pegar o ônibus. Quase fui atropelada, perdi o ônibus, chorei, peguei um uber. Tem coisas que não sao pra ser.",1,0,2,206,[],[],[],https://pbs.twimg.com/profile_images/1767760931784634368/4uJRpQIB_bigger.jpg,https://x.com/yastld/status/1810656771205198270,tweet_id:1810656771205198270
João Silva Brasília,@bsb_joaosilva,2024-07-09T00:05:30.000Z,False,"Ter, de longe, o maior ORÇAMENTO PER CAPITA DO PAÍS e mesmo assim ter criança morrendo sem atendimento de saúde, ter transporte público péssimo (e caro), ter alagamento em regiões pobres TODO ANO, não ter nenhuma opção de lazer PÚBLICA fora do Plano.",0,0,1,31,[],[],[],https://pbs.twimg.com/profile_images/1123022306329206784/YlhpIOFY_bigger.png,https://x.com/bsb_joaosilva/status/1810465263940452494,tweet_id:1810465263940452494
Lucas Martins,@Lucas1Mart,2024-07-08T23:12:09.000Z,False,"O que mais me faz passar raiva é o transporte público, eu moro no plano e pego ônibus todo dia e passo raiva todo dia. Falta de pontualidade, lotação, não tem ar-condicionado, e não tem ônibus nos finais de semana. Brasília tem potencial pra ter um bom transporte …",1,0,0,16,[],[],[],https://pbs.twimg.com/profile_images/1893061835680595968/EhsLp2_-_bigger.jpg,https://x.com/Lucas1Mart/status/1810451837616529843,tweet_id:1810451837616529843
Naluu,@naluizafr,2024-07-08T21:40:19.000Z,False,Transporte público/ mobilidade urbana e cultura higienista que estão relacionados o que não é Brasília está totalmente abandonado,0,0,1,60,[],[],[],https://pbs.twimg.com/profile_images/1773832155149336576/W30Lm2O6_bigger.jpg,https://x.com/naluizafr/status/1810428726640889991,tweet_id:1810428726640889991
Prof. Fernando Henrique,@fernandocmf007,2024-07-08T18:35:35.000Z,False,"Utilizando o transporte público, em Brasília isso é um feito.",0,0,0,12,[],[],[],https://pbs.twimg.com/profile_images/1188558827488194560/71yJDc6Z_bigger.jpg,https://x.com/fernandocmf007/status/1810382239232127346,tweet_id:1810382239232127346
misty quigley anjinha inocente,@godnerys,2024-07-07T23:55:14.000Z,False,brasilia é um lugar tão cansativo (se vc é pobre e não mora nas asas) ou vc passa horas comparáveis a uma viagem interestadual no transporte publico ou vc nem consegue atingir seus objetivos e ambições simplesmente pq mora longe,0,0,0,8,[],[],[],https://pbs.twimg.com/profile_images/1800091064419704832/_RvF1Quv_bigger.jpg,https://x.com/godnerys/status/1810100294191133181,tweet_id:1810100294191133181
Ônibus & Transporte,@onibustransport,2024-07-07T20:22:25.000Z,False," Novidade no transporte público! A partir de segunda-feira (08), será reativada a linha de ônibus da Rodoviária do Plano Piloto para a Esplanada dos Ministérios, em Brasília (DF). Saiba mais no link: https://bit.ly/4cLFfS5 #transportepublico #brasilia… https://bit.ly/4cLFfS5",0,0,1,43,"['#transportepublico', '#brasilia']",[],['\\U0001f68c'],https://pbs.twimg.com/profile_images/1904722754030497792/7o0C6L9a_bigger.jpg,https://x.com/onibustransport/status/1810046736619991214,tweet_id:1810046736619991214
GDB,@GDB_LPN,2024-07-05T16:01:54.000Z,False,"Em vários aspectos eu diria que sim…exceto no transporte público, q é um dos piores do país…pq a elite não quer que os pobres de Brasília tenham acesso às áreas das elites, então há poucos ônibus pro centro, ônibus velhos caindo os pedaços, metrô ridículo e velho…",1,0,1,103,[],[],[],https://pbs.twimg.com/profile_images/1854301662443118594/pVS-f3nX_bigger.jpg,https://x.com/GDB_LPN/status/1809256399391576123,tweet_id:1809256399391576123
Morgana uma Morcega,@morgs_cabral,2024-07-05T14:40:00.000Z,False,"Não conhece brasilia mas a pergunta “pra quem” é bem valida pra onde eu moro, “uma das melhores cidades do estado de sp pra se viver” mas q nao tem transporte publico decente (tem que andar de carro ou de uber) que não tem lazer acessível (nem de preço e nem de local) e com +",2,0,1,147,[],[],[],https://pbs.twimg.com/profile_images/1771174869444485120/f505XNPB_bigger.jpg,https://x.com/morgs_cabral/status/1809235787763913045,tweet_id:1809235787763913045
Repórter Brasília,@reportbrasilia,2024-07-04T19:47:05.000Z,False,"Um mês antes do início da implantação do novo sistema de bilhetagem automática do transporte público do Distrito Federal que extingue o pagamento em dinheiro dentro dos coletivos, ...",0,0,0,3,[],[],[],https://pbs.twimg.com/profile_images/1301167081451409408/QaIXpSVo_bigger.jpg,https://x.com/reportbrasilia/status/1808950679693586550,tweet_id:1808950679693586550
amanda,@cacioepeppe,2024-07-04T17:17:55.000Z,False,"os profs de pu 2 é meio que tipo: ""o transporte público de brasília é uma merda! dito isso não vamos tolerar atrasos na nossa aula""",0,0,1,68,[],[],[],https://pbs.twimg.com/profile_images/1889128620708290560/xyzDRaJs_bigger.jpg,https://x.com/cacioepeppe/status/1808913142283489686,tweet_id:1808913142283489686
Bitcoin é aqui! Rolante,@bitcoineaqui,2024-07-04T09:48:56.000Z,True,"Está proibido usar dinheiro em papel em Brasília no transporte público!

Pronto, agora se foi o boi com as canga""!",0,1,8,360,[],[],[],https://pbs.twimg.com/profile_images/1649787390645420033/bof5Hlun_bigger.jpg,https://x.com/bitcoineaqui/status/1808800149403025537,tweet_id:1808800149403025537
phelipe,@pheIipes,2024-07-03T19:12:06.000Z,False,"literalmente. sou de São Paulo, morei em Brasília por quase 6 anos. não se compara, deslocamento em SP é mais demorado mesmo considerando qualquer fator de bsb como trânsito ou o transporte público ruim.",1,1,3,52,[],[],[],https://pbs.twimg.com/profile_images/1859707015490052097/Etb6_SAN_bigger.jpg,https://x.com/pheIipes/status/1808579488172642346,tweet_id:1808579488172642346
João José Forni,@jjforni,2024-07-03T14:34:50.000Z,False,"Brasília é a capital com melhor desempenho em qualidade de vida, seguida por Goiânia, Belo Horizonte, Florianópolis e Curitiba. A informação consta no levantamento IPS Brasil 2024. Mas ainda falta resolver o transporte público e a mobilidade em geral.",0,0,0,98,[],[],[],https://pbs.twimg.com/profile_images/378800000559098061/568518fc8e141858c9e5b61c9154da40_bigger.jpeg,https://x.com/jjforni/status/1808509711207018979,tweet_id:1808509711207018979
.,@paulambelmonte,2024-07-03T13:58:01.000Z,True,"O transporte público de Brasília tem vários problemas. Os usuários reclamam da conduta dos motoristas, que nem sempre param quando acenam e têm dificuldade em passar informações.+",2,6,38,700,[],[],[],https://pbs.twimg.com/profile_images/1907445776382345216/_RDn1iNf_bigger.jpg,https://x.com/paulambelmonte/status/1808500447214199230,tweet_id:1808500447214199230
Agência Brasília,@AgenciaBrasilia,2024-07-02T13:00:00.000Z,False," Mais facilidade no transporte público do DF: 25 novos pontos de recarga de cartões de bilhetagem em funcionamento! Também é possível recarregar via Pix pelo app BRB Mobilidade. 

Confira os novos pontos de recarga: https://agenciabrasilia.df.gov.br/2024/06/30/df-ganha-25-novos-pontos-de-recarga-dos-cartoes-de-bilhetagem-do-transporte-publico/…",0,0,1,202,[],[],"['\\U0001f68d', '\\U0001f4b3']",https://pbs.twimg.com/profile_images/1587505169117347840/sjjvwZ7v_bigger.jpg,https://x.com/AgenciaBrasilia/status/1808123458066567530,tweet_id:1808123458066567530
BandNews FM Brasília,@bandnewsbsb,2024-07-01T19:51:18.000Z,False,"Cinquenta e duas linhas de ônibus do transporte público do Distrito Federal já deixaram de receber dinheiro em espécie como forma de pagamento nesta segunda-feira (1º). Esse número corresponde a cerca de 5% do total de linhas, que atualmente, são 919",0,1,0,180,[],[],[],https://pbs.twimg.com/profile_images/1351313545703653376/12golfa1_bigger.jpg,https://x.com/bandnewsbsb/status/1807864575783481426,tweet_id:1807864575783481426
Repórter Brasília,@reportbrasilia,2024-07-01T18:51:29.000Z,False,"Nesta segunda-feira (1º), 52 linhas de ônibus do sistema de transporte público coletivo do Distrito Federal deixaram de aceitar dinheiro como método de pagamento. https://reporterbrasilia.com.br/ja-esta-valendo-onibus-deixam-de-receber-pagamento-em-dinheiro/…",0,0,0,19,[],[],[],https://pbs.twimg.com/profile_images/1301167081451409408/QaIXpSVo_bigger.jpg,https://x.com/reportbrasilia/status/1807849522678161787,tweet_id:1807849522678161787
WFerraz representa 50 milhões flamenguistas aqui.,@TUDOSOBREOFLADF,2024-07-01T15:31:26.000Z,False,"Sem sinal de internet, fica difícil para o povo atender à modernidade... GDF passou o carro na frente dos bois e, povo que paga o pato, com todos esse problemas para pagar passagens, no péssimo sistema de transporte público de Brasília... #DF1",0,0,1,34,['#DF1'],[],[],https://pbs.twimg.com/profile_images/1881093420439273472/-8WUcEs1_bigger.jpg,https://x.com/TUDOSOBREOFLADF/status/1807799181530038563,tweet_id:1807799181530038563
Carmen Regina Souza,@CarmenRSouza,2024-07-01T08:42:26.000Z,True,"Pergunta: 
As passagens para deslocamento,  entre o estado de origem do político e Brasília é custeado pelos escravos que mal transporte público de qualidade possuem? 

Com todo o avanço tecnológico, não está na hora de levantarmos a bandeira da  reforma política? 

Diminuir o",0,0,1,90,[],[],[],https://pbs.twimg.com/profile_images/1679125101659189254/6ymQUl3V_bigger.jpg,https://x.com/CarmenRSouza/status/1807696251636380098,tweet_id:1807696251636380098
garfo,@dearlykan,2024-06-29T18:32:02.000Z,False,transporte publico no rio eh mt melhor que o de brasília pqp,2,0,0,68,[],[],[],https://pbs.twimg.com/profile_images/1907231693590679552/widnBSab_bigger.jpg,https://x.com/dearlykan/status/1807119852550627539,tweet_id:1807119852550627539
Christina,@Christi69294843,2024-06-29T03:25:33.000Z,False,"Brasília é a anti-cidade, quadras isoladas, impossível para pedestres, difícil para transporte público..  clima horrível e muito seco. Tudo segmentado.. prédios esquisitos, fora da escala humana, além de feios (o que é aquele ovo?).",1,1,2,34,[],[],[],https://pbs.twimg.com/profile_images/1143645706902806529/wKkD1SYI_bigger.jpg,https://x.com/Christi69294843/status/1806891728265216174,tweet_id:1806891728265216174
.,@ae383829,2024-06-28T18:01:44.000Z,False,Eu acho Brasília linda e acho que o realmente iria democratizar a cidade e seus arredores seria um boa rede de transporte público. Os preços no plano piloto jamais serão acessíveis à população de baixa renda,0,0,9,265,[],[],[],https://pbs.twimg.com/profile_images/1245380788725710852/9pODg_JY_bigger.jpg,https://x.com/ae383829/status/1806749838903505367,tweet_id:1806749838903505367
Matheus Pimentel,@ummatheus,2024-06-27T21:36:23.000Z,False,Acho que é mais producente pensar em como expandir o transporte público (o metrô de Brasília é ridículo) e essa kilometragem toda de mato abandonado que fica na periferia E entre a periferia e o centro,0,0,3,90,[],[],[],https://pbs.twimg.com/profile_images/1864728250007601152/C_bfUir__bigger.jpg,https://x.com/ummatheus/status/1806441469621723594,tweet_id:1806441469621723594
violeta,@macHadassa,2024-06-27T21:15:15.000Z,False,"Voltei a usar máscara no transporte público pq em Brasília no inverno 7 em cada 10 pessoas estão doente e eu n quero ficar doente de nd, nem gripe nem COVID, nem nd",0,0,0,39,[],[],[],https://pbs.twimg.com/profile_images/1393437364752687105/hYmikMV6_bigger.jpg,https://x.com/macHadassa/status/1806436152188301319,tweet_id:1806436152188301319
Cézar Ferreira,@kojonas45,2024-06-27T18:25:45.000Z,False,"Mas nunca foi bom o transporte público de Brasília, metrô não cobre suficientemente a cidade nem tem capacidade pra aguentar toda a população.",1,0,1,31,[],[],[],https://pbs.twimg.com/profile_images/1721581725401198592/pJn2tQNz_bigger.jpg,https://x.com/kojonas45/status/1806393496854479295,tweet_id:1806393496854479295
Débora Lima,@DeboraLima1982,2024-06-27T15:10:48.000Z,False,"Faço Rio x Brasília toda semana, morando em Campo Grande. Nada é pior que encarar av. Brasil, gastando uma fortuna de uber, pq transporte público CG x Galeão não existe, ainda mais de madrugada. Sem contar que o Galeão é um horror de aeroporto. Nessa, eu não apoio ",1,0,3,330,[],['@eduardopaes'],[],https://pbs.twimg.com/profile_images/1380887889056268294/FEYgw-i8_bigger.jpg,https://x.com/DeboraLima1982/status/1806344435371774295,tweet_id:1806344435371774295
Slime Smile,@kimitripguila,2024-06-27T13:13:04.000Z,False,"saquei. eu acho q sinceramente n resolveria. pq ao invés de melhorar o transporte público, criando metro,vlt,brt..e melhorar as outras 
partes de Brasília q necessitam de muito, essa ação iria piorar o plano pois ele só funciona bem por causa da densidade demográfica planejada +",3,0,0,155,[],[],[],https://pbs.twimg.com/profile_images/1699791576917299200/TUb2fjAk_bigger.jpg,https://x.com/kimitripguila/status/1806314806581887193,tweet_id:1806314806581887193
júlia é linda vestida,@jolinhaaa,2024-06-27T12:21:31.000Z,False,o transporte público de brasilia ainda vai fazer eu me matar,0,0,0,24,[],[],[],https://pbs.twimg.com/profile_images/1902492668896382976/rG4pzzdC_bigger.jpg,https://x.com/jolinhaaa/status/1806301832995611096,tweet_id:1806301832995611096
Rebeca,@exrebeca,2024-06-27T10:36:40.000Z,False,O TRANSPORTE PÚBLICO DE BRASÍLIA É UM LIXOOOOOOOOO,0,0,0,84,[],[],[],https://pbs.twimg.com/profile_images/1895219075187359744/QlCzhsf3_bigger.jpg,https://x.com/exrebeca/status/1806275446973096057,tweet_id:1806275446973096057
