Name,Handle,Timestamp,Verified,Content,Comments,Retweets,Likes,Analytics,Tags,Mentions,Emojis,Profile Image,Tweet Link,Tweet ID
corninho flambado by I.A,@antonio_timbo2,2024-11-06T01:27:11.000Z,False,"Tem vida noturna, tem transporte público, tem mais empregos e chances de crescer fora de concurso, tem muita poluição, mas tem locais sem tanta poluição tbm como Ipiranga e tals 

São Paulo teria que se esforçar muito pra ser tão ruim quando Brasília ainda",1,0,1,346,[],[],[],https://pbs.twimg.com/profile_images/1876635373993852928/MDzh9oPF_bigger.jpg,https://x.com/antonio_timbo2/status/1853972364343570815,tweet_id:1853972364343570815
Repórter Brasília,@reportbrasilia,2024-11-05T18:57:39.000Z,False,BRB Mobilidade celebra 5 anos de inovação no sistema de transporte público do Distrito Federal,1,0,0,50,[],[],[],https://pbs.twimg.com/profile_images/1301167081451409408/QaIXpSVo_bigger.jpg,https://x.com/reportbrasilia/status/1853874336773652911,tweet_id:1853874336773652911
big momma,@belatrizzzz,2024-11-05T17:15:07.000Z,False,"me mudei pra Brasilia tem 3 anos e o ponto alto de morar aqui é a tranquilidade e a segurança, é perfeito pra núcleos familiares mas pra jovens e/ou solteiros não indico, lazer extremamente elitizado, transporte publico ruim…",2,0,29,1.7K,[],[],[],https://pbs.twimg.com/profile_images/1882591446487764992/CmU4-j04_bigger.jpg,https://x.com/belatrizzzz/status/1853848529816485932,tweet_id:1853848529816485932
CBN Brasília,@cbnbrasilia,2024-11-04T15:38:41.000Z,False,"ASSIM É BRASÍLIA - Rodrigo Chia
Projeto de lei é nova tentativa de garantir transparência aos dados do transporte público.https://cbn.globo.com/podcasts/cbn-brasilia/…",0,2,3,789,[],[],[],https://pbs.twimg.com/profile_images/1575545574132224004/A3X0jBrY_bigger.jpg,https://x.com/cbnbrasilia/status/1853461874060185983,tweet_id:1853461874060185983
alprazolet,@radioactiveuss,2024-11-03T01:55:17.000Z,False,nao entendi quase nada do funcionamento do transporte público de brasilia enfim entrarei em um ônibus e vou perguntar bem simpática assim ô motorista p eu chegar na unb eu desço onde e pego qual ônibus por favor brigadaaaa,0,0,0,35,[],[],[],https://pbs.twimg.com/profile_images/1873101878776549376/k0IsGia4_bigger.jpg,https://x.com/radioactiveuss/status/1852892271106035988,tweet_id:1852892271106035988
Jornal de Brasília,@OficialJBr,2024-11-02T18:13:49.000Z,True,Um levantamento do Instituto Fogo Cruzado mostra que pelo menos 156 pessoas foram bal3adas no transporte público na região metropolitana do Rio de Janeiro nos últimos oito anos,0,0,0,109,[],[],[],https://pbs.twimg.com/profile_images/1197506886867849216/ZqDqNqqQ_bigger.jpg,https://x.com/OficialJBr/status/1852776142484209732,tweet_id:1852776142484209732
Rickson ✠,@ricksongarciap,2024-11-02T11:09:48.000Z,False,"""Vida real"" Cara, 25% da população brasileira está nas regiões metropolitanas de sp, RJ e BH. Isso sem contar Brasília, Recife e outras. E o maior ainda, a maioria esmagadora das pessoas vão trabalhar de transporte público, que nem cidade média demora 20 minutos um trajeto",0,0,17,374,[],[],[],https://pbs.twimg.com/profile_images/1326203608682156032/KVkzjbbe_bigger.jpg,https://x.com/ricksongarciap/status/1852669434000814278,tweet_id:1852669434000814278
Jhon,@FalaJhonJhon1,2024-11-02T10:34:07.000Z,False,"Esse povo otario de Brasília que usa transporte público e só toma no olho do uc, daqui 2 anos e eleições novamente, votem na piranha da  e no vagabundo do  de novo 
Bando de otario. Ai quando vai pegar metrô ou ônibus sorria. Arrombados 
Bom dia ",0,0,0,123,[],"['@celinaleao', '@IbaneisOficial']","['\\U0001f603', '\\u2600\\ufe0f']",https://pbs.twimg.com/profile_images/1905117414141919232/jYSp8SEi_bigger.jpg,https://x.com/FalaJhonJhon1/status/1852660452230086928,tweet_id:1852660452230086928
A l ê,@oaleisaac,2024-10-31T12:39:04.000Z,False,Não tem 2h que acordei e já surtei 5 vezes com o transporte público de brasilia,0,0,0,43,[],[],[],https://pbs.twimg.com/profile_images/1632463601943420931/GxEP5JqF_bigger.jpg,https://x.com/oaleisaac/status/1851967120638198071,tweet_id:1851967120638198071
mont,@mont__002,2024-10-31T04:15:30.000Z,False,"cara, a viagem de avião de sao paulo ate brasilia é 3h só, nao faz nem diferença na vida dele, tem gente que perde mais horas do dia em transporte publico do que isso",0,0,35,4.4K,[],[],[],https://pbs.twimg.com/profile_images/1891236356522749952/vH2evBrx_bigger.jpg,https://x.com/mont__002/status/1851840396113911925,tweet_id:1851840396113911925
Lucas Martins,@Lucas1Mart,2024-10-30T22:44:55.000Z,False,É impossível ser usuário do transporte público em Brasília.,0,0,0,10,[],[],[],https://pbs.twimg.com/profile_images/1893061835680595968/EhsLp2_-_bigger.jpg,https://x.com/Lucas1Mart/status/1851757201821438102,tweet_id:1851757201821438102
Luíla,@louila_,2024-10-30T21:08:33.000Z,False,"brasília maior vergonha do transporte público, se o mundo não acabar antes talvez em uns 430 anos a gente chega lá",0,0,4,135,[],[],[],https://pbs.twimg.com/profile_images/1844044456732868608/8ygzdMq9_bigger.jpg,https://x.com/louila_/status/1851732950775214248,tweet_id:1851732950775214248
Edmilson Papo 10,@papodezricifi,2024-10-30T00:10:34.000Z,False,"Ninguém morre de bala perdida em cobertura no Leblon 
Ninguém morre de bala perdida em gabinetes em Brasília 
Ninguém morre de bala perdida em carros blindados com escolta armada e tudo pago por quem é fuzilado em transporte público",1,4,23,173,[],[],[],https://pbs.twimg.com/profile_images/1724151282380705792/g7_nrLUj_bigger.jpg,https://x.com/papodezricifi/status/1851416369398432005,tweet_id:1851416369398432005
Xofana Magia,@XofanaMagia,2024-10-29T15:49:57.000Z,False,Te odeio transporte público de Brasília te odeio,0,0,0,10,[],[],[],https://pbs.twimg.com/profile_images/1825376972932874240/gduyfD6k_bigger.jpg,https://x.com/XofanaMagia/status/1851290385349308834,tweet_id:1851290385349308834
giuzinha,@giunemexiste,2024-10-28T19:45:29.000Z,False,"Pela percepção do turismo é muito massa mesmo, mas olhando por uma perspectiva de incentivo ao lazer e cultura, e transporte público, Brasília ainda falha muito. 

Mané mesmo sendo central, não é tão próximo ao metrô (e em ambos os dias os shows acabaram 23h)",2,0,25,3.5K,[],[],[],https://pbs.twimg.com/profile_images/1891586921215762432/oPE7GXQR_bigger.jpg,https://x.com/giunemexiste/status/1850987271937208654,tweet_id:1850987271937208654
Ana,@analuizadenovo,2024-10-27T16:12:24.000Z,True,"Aqui em Brasília no mínimo com transporte público, você gasta isso",1,0,1,240,[],[],[],https://pbs.twimg.com/profile_images/1862182257005334528/8WLrP0yp_bigger.jpg,https://x.com/analuizadenovo/status/1850571257797873829,tweet_id:1850571257797873829
Mari Valentim,@marivalentimdf,2024-10-27T13:27:58.000Z,True,"O Plano Piloto é um exemplo de Urbanismo ultrapassado. Brasília vc não anda a pé. Depende de carro para tudo. As cidades satélites são distantes e por isso o transporte público caro é deficitário.

 Um belo estudo de caso de como NÃO se deve planejar cidades HOJE.",1,0,1,56,[],[],[],https://pbs.twimg.com/profile_images/1582472215764819972/tDgMqd_9_bigger.jpg,https://x.com/marivalentimdf/status/1850529875922133227,tweet_id:1850529875922133227
Sinpro-DF,@sinprodf,2024-10-26T14:00:02.000Z,False,"De 4 de novembro a 1º de dezembro, o público tem a oportunidade de conhecer a obra DE VER CIDADE – Brasília Numa Caixa de Brincar, na Biblioteca Nacional. O circuito oferece transporte sem custo para escolas públicas.https://sinprodf.org.br/bncdbcb",0,0,0,30,[],[],[],https://pbs.twimg.com/profile_images/1662090979371827200/PsB3L-bN_bigger.jpg,https://x.com/sinprodf/status/1850175558140977156,tweet_id:1850175558140977156
Grazi,@graz_is,2024-10-25T15:55:29.000Z,False,"Transporte em Brasília é outro nível, só Uber que não é confiável. Agora o público é tranquilo, especialmente o metrô.",0,0,2,49,[],[],[],https://pbs.twimg.com/profile_images/1900604194442055680/5t5ZU-EJ_bigger.jpg,https://x.com/graz_is/status/1849842224877453672,tweet_id:1849842224877453672
Portal UNIBUS,@portalunibus,2024-10-25T13:54:38.000Z,False,"A Viação Piracicabana reforça seu compromisso com a modernização ao adquirir 150 novos ônibus Apache Vip V para operação em Brasília. Com tecnologia, conforto e acessibilidade, os veículos prometem melhorar o transporte público na região. Saiba mais em https://bit.ly/48khBKU.",0,0,0,23,[],[],[],https://pbs.twimg.com/profile_images/1763786094737297408/NymCshUL_bigger.jpg,https://x.com/portalunibus/status/1849811810326577162,tweet_id:1849811810326577162
Bp. João Valdevino,@joaovaldev31049,2024-10-24T22:09:14.000Z,True,"Resposta eleitoreira, ou seja,  em seu segundo mandato nunca resolveu o básico que é  transporte público coletivo do entorno Norte e Sul de Brasília que é o mais caro e sucateado do país!  Conta outra piada senhor governador!",0,0,0,15,[],[],[],https://pbs.twimg.com/profile_images/1706426193610760192/9gmK58sx_bigger.jpg,https://x.com/joaovaldev31049/status/1849573893213987293,tweet_id:1849573893213987293
Bp. João Valdevino,@joaovaldev31049,2024-10-24T22:08:43.000Z,False,"Resposta eleitoreira, ou seja,  em seu segundo mandato nunca resolveu o básico que é  transporte público coletivo do entorno Norte e Sul de Brasília que é o mais caro e sucateado do país!  Conta outra piada senhor governador!",0,0,0,39,[],[],[],https://pbs.twimg.com/profile_images/1706426193610760192/9gmK58sx_bigger.jpg,https://x.com/joaovaldev31049/status/1849573762749845777,tweet_id:1849573762749845777
GABI PENTACAMPEÃO DA COPA BR,@Bielpr1,2024-10-24T11:36:29.000Z,False,O governador de Brasília respondeu minha afirmação de que as obras do viaduto do jardim botânico estavam paradas. Na ocasião estavam e estamos no final de outubro e a parte obra não foi entregue. O trânsito do DF está infernal e o transporte público continua horrível.,0,0,1,51,[],[],[],https://pbs.twimg.com/profile_images/1903283431842127872/ron5ITaw_bigger.jpg,https://x.com/Bielpr1/status/1849414658047737882,tweet_id:1849414658047737882
victor,@telexkinetic,2024-10-23T21:25:44.000Z,False,uma das coisas q eu mais odeio no mundo é o transporte publico de brasilia,0,0,0,25,[],[],[],https://pbs.twimg.com/profile_images/1900287698755067904/ghXtOCK4_bigger.jpg,https://x.com/telexkinetic/status/1849200560240566303,tweet_id:1849200560240566303
Thael Pires,@thatadf,2024-10-22T21:23:50.000Z,False,"Nenhuma novidade chover dentro do transporte público de Brasília! 
Ibaneis e o Semob, são uma vergonha!",0,0,0,21,[],[],[],https://pbs.twimg.com/profile_images/1813324683258851328/iYdh1pCH_bigger.jpg,https://x.com/thatadf/status/1848837693427577118,tweet_id:1848837693427577118
fc ruan vitor vaqueirinho,@rouserosinha,2024-10-22T15:34:33.000Z,False,brasilia se CONSAGROU como capital de pais com o transporte publico mais BOSTA do mundo. o famoso metro que só sai de VINTE EM VINTE MINUTOS EM HORARIO DE >>PICO<< VAI PRO INFERNOOO,0,0,6,308,[],[],[],https://pbs.twimg.com/profile_images/1884324249982095360/gT49bqXX_bigger.jpg,https://x.com/rouserosinha/status/1848749792140107836,tweet_id:1848749792140107836
Marcos Fraga,@_Marcos_Fraga_,2024-10-21T21:43:42.000Z,False,Exatamente ! A população de Brasília merece um mínimo de respeito com transporte público de qualidade!,0,0,6,176,[],[],[],https://pbs.twimg.com/profile_images/1595979278537170945/dvbvpIT7_bigger.jpg,https://x.com/_Marcos_Fraga_/status/1848480306837471430,tweet_id:1848480306837471430
Dudex,@leaozyn_,2024-10-18T14:17:43.000Z,False,odeio odeio odeio transporte público em Brasília cara,0,0,1,27,[],[],[],https://pbs.twimg.com/profile_images/1907923326980288514/v5ySBuzd_bigger.jpg,https://x.com/leaozyn_/status/1847280904319746173,tweet_id:1847280904319746173
Miku na paleta de cor errada,@Birb1328,2024-10-17T19:11:33.000Z,False,Brasília qse perfeita com transporte público funcionando,1,0,0,7,[],[],[],https://pbs.twimg.com/profile_images/1906366881339957249/xdfoYO8g_bigger.jpg,https://x.com/Birb1328/status/1846992465917534493,tweet_id:1846992465917534493
bruna,@brunamussi_,2024-10-17T14:10:42.000Z,False,"Pediram para eu não vazar mas….  Réveillon em Brasília vai ter….  
TESOURINHA INUNDADA, FACADA NA ESPLANADA, TRANSPORTE PÚBLICO ATÉ 00h E TODO MUNDO SAINDO DA CIDADE
Turistas, Podem reservar seus quartos de hotel!
brasilienses, se preparem!",0,0,1,129,[],[],[],https://pbs.twimg.com/profile_images/1858338149845372928/uE8hsZjQ_bigger.jpg,https://x.com/brunamussi_/status/1846916753047118086,tweet_id:1846916753047118086
bang chan's home,@bangyedawn,2024-10-15T17:10:25.000Z,False,amiga sempre consegui ler livro muito de boa no ônibus e transporte público em geral mas aí eu descobri quando fui em sp que eu só consigo fazer isso em brasilia kkkkkkk,0,0,0,19,[],[],[],https://pbs.twimg.com/profile_images/1905730174127345664/NskvrXqW_bigger.jpg,https://x.com/bangyedawn/status/1846237202784686096,tweet_id:1846237202784686096
choque do trovão,@iquevetor,2024-10-14T21:42:16.000Z,False,"VAI TOMAR NO CU TRANSPORTE PUBLICO DE BRASILIAVAI TOMAR NO CU GOVERNO
VAI TOMAR NO CU BRASIL
VAI TOMAR NO CU CHUVA
ODEIO CHUVA JA DEU DE CUVA",1,0,5,198,[],[],[],https://pbs.twimg.com/profile_images/1625757580487163904/GXg9opin_bigger.jpg,https://x.com/iquevetor/status/1845943229029798143,tweet_id:1845943229029798143
Guba,@Hey_Guba,2024-10-14T19:47:07.000Z,False,"Acho engraçado quem pede explicações sobre o transporte público de Brasília. Eu larguei de mão e decidi apenas aceitar ficar 1 hora esperando o ônibus passar, pelo visto ninguém vai se empenhar em melhorar mesmo",0,0,1,33,[],[],[],https://pbs.twimg.com/profile_images/1908671525969960960/NtNGMJRk_bigger.jpg,https://x.com/Hey_Guba/status/1845914249920495768,tweet_id:1845914249920495768
ⓟalenrix |,@palenrix,2024-10-14T15:02:48.000Z,True,"transporte público não funciona em Brasília simplesmente conta do espraiamento urbano de baixa densidade

isso impacta inclusive a agricultura familiar e a proteção de nascentes

mas a grande parte dos brasilienses não está pronta para conversar sobre densidade",5,13,78,4.4K,[],[],[],https://pbs.twimg.com/profile_images/1688555901165223936/u7Sy9oVy_bigger.jpg,https://x.com/palenrix/status/1845842698688725398,tweet_id:1845842698688725398
Negzus,@Negzus1,2024-10-14T03:56:32.000Z,True,"o maior problema foi o cansaço de me locomover em Brasília, esse transporte público daqui é CARO, HORRENDO e cansativo",2,0,1,66,[],[],[],https://pbs.twimg.com/profile_images/1900455362651664384/d_X9XiMR_bigger.jpg,https://x.com/Negzus1/status/1845675028907446465,tweet_id:1845675028907446465
CafetinaDaVirtude,@Tatatrt,2024-10-13T02:27:58.000Z,True,"Brasília tem um conceito único, inovador e horroroso! E, apesar de inspirada na arquitetura soviética, é completamente anti pobre, dificulta caminhada e o transporte público.",5,0,31,1.2K,[],[],[],https://pbs.twimg.com/profile_images/1830315290229407744/6rDkmvhZ_bigger.jpg,https://x.com/Tatatrt/status/1845290350602047836,tweet_id:1845290350602047836
Joca,@joaquim__cardim,2024-10-12T16:32:18.000Z,False,"- Brasília é horrorosa não só em beleza, mas é mal-pensada para pedestres, transporte público, moradores, e sepa mais…
- Esse tal do palácio no Paraguai pode ser colonial E ser bonito ao mesmo tempo. É imbecil a logica de q estruturas “perdem” beleza por contextos históricos",0,0,0,33,[],[],[],https://pbs.twimg.com/profile_images/1787027821816070144/ziEChhjq_bigger.jpg,https://x.com/joaquim__cardim/status/1845140448722989120,tweet_id:1845140448722989120
Melhor Brasília,@MelhorBrasilia,2024-10-12T15:50:43.000Z,False,"E aí a cidade vai se limitando a evento em clube, em estacionamento, cercado de alambrado, longe de transporte público, que só se chega de Uber. Há uma razão pras áreas mais centrais e populosas da cidade terem mais efervescência cultural. É espontâneo, acessível e democrático.",1,0,14,190,[],[],[],https://pbs.twimg.com/profile_images/1644418752774119425/h15Xkoab_bigger.jpg,https://x.com/MelhorBrasilia/status/1845129981560488218,tweet_id:1845129981560488218
samael,@ramenzin,2024-10-12T14:45:23.000Z,False,"Tira todo o funcionarismo público daí e vamo ver quanto tempo dura como terceira maior cidade. Brasília é uma cidade anti-gente, sem infraestrutura de transporte. Uma cidade sintética feita pra atender um propósito, não a pessoas. Ao menos, não as comuns.",0,0,2,32,[],[],[],https://pbs.twimg.com/profile_images/1889399807501910016/BpfqzKe1_bigger.jpg,https://x.com/ramenzin/status/1845113541264613875,tweet_id:1845113541264613875
Agência Brasília,@AgenciaBrasilia,2024-10-12T11:53:40.000Z,False,"Feriado de 12 de outubro tem operação especial no transporte público! Devido a eventos na área central de Brasília, haverá reforço de viagens. Saiba mais: https://agenciabrasilia.df.gov.br/2024/10/10/feriado-de-12-de-outubro-tem-operacao-especial-no-transporte-publico…",0,0,0,116,[],[],[],https://pbs.twimg.com/profile_images/1587505169117347840/sjjvwZ7v_bigger.jpg,https://x.com/AgenciaBrasilia/status/1845070327472095567,tweet_id:1845070327472095567
O Amargurado,@basedPererecas,2024-10-11T21:48:30.000Z,False,"do que hoje, Brasília está no ranking de 10 piores cidades em questão de transporte público, você acaba com uma cidade que é horrível para se movimentar, onde se tem a maior favela do Brasil e assim por diante.",0,1,13,421,[],[],[],https://pbs.twimg.com/profile_images/1907177924270120960/QTS82HGO_bigger.jpg,https://x.com/basedPererecas/status/1844857632835727639,tweet_id:1844857632835727639
Pete_Festeiro,@Pedroig_zaz,2024-10-11T14:29:26.000Z,False,"Brasília é um lixo, mas não por esses motivos aí, o planejamento segregatorio da cidade perpassa por outras camadas: transporte público, descaso com cidades satélites... Brutalismo é o que salva Brasília de ser uma cidade piegas e sem alma",0,0,11,789,[],[],[],https://pbs.twimg.com/profile_images/1897304584575492097/7532dW8C_bigger.jpg,https://x.com/Pedroig_zaz/status/1844747140175671297,tweet_id:1844747140175671297
Diário do Poder,@diariodopoder,2024-10-11T09:00:50.000Z,True,"O sistema de bilhetagem 100% eletrônico, no transporte público de Brasília, completou 90 dias e os dados do programa apontam a preferência dos usuários pelos meios digitais de pagamento das passagens. https://diariodopoder.com.br/brasil-e-regioes/distrito-federal/ttc-distrito-federal/cai-para-8-no-df-pagamento-de-passagens-de-onibus-em-especie…",0,1,4,390,[],[],[],https://pbs.twimg.com/profile_images/1828162529257807872/LiJhYM8L_bigger.jpg,https://x.com/diariodopoder/status/1844664444984406189,tweet_id:1844664444984406189
Cardoso,@_duda_card,2024-10-10T21:44:38.000Z,False,"Finalmente posso voltar a reclamar do transporte público de Brasília. Essa porra não quer aceitar dinheiro, mas dá erro direto na hora de passar cartão de débito. Que ódio",0,0,1,47,[],[],[],https://pbs.twimg.com/profile_images/1826977680035598336/fOo-Nc_4_bigger.jpg,https://x.com/_duda_card/status/1844494273674346887,tweet_id:1844494273674346887
Jornal de Brasília,@OficialJBr,2024-10-10T12:32:51.000Z,True,Feriado de 12 de outubro tem operação especial no transporte público,0,0,0,61,[],[],[],https://pbs.twimg.com/profile_images/1197506886867849216/ZqDqNqqQ_bigger.jpg,https://x.com/OficialJBr/status/1844355412759544204,tweet_id:1844355412759544204
Diário do Poder,@diariodopoder,2024-10-09T23:37:09.000Z,True,"Cai para 8% no DF pagamento de passagens de ônibus em espécie: O sistema de bilhetagem 100% eletrônico, no transporte público de Brasília, completou 90 dias e… http://dlvr.it/TF9rzT #DiariodoPoder",0,0,1,442,['#DiariodoPoder'],[],[],https://pbs.twimg.com/profile_images/1828162529257807872/LiJhYM8L_bigger.jpg,https://x.com/diariodopoder/status/1844160200951070739,tweet_id:1844160200951070739
SAMPER,@CamiloSamperZ,2024-10-02T18:38:46.000Z,False,"Ciertas empresas de transporte público (Buses intermunicipales) deberían exigir más responsabilidad a sus conductores, adelantan en doble línea, superan límites de velocidad permitidos, exponen a usuarios y demás actores a accidentes. 

Cootrasegua, Brasilia, copetran, Berlina",0,0,1,162,[],[],[],https://pbs.twimg.com/profile_images/1779541805320519682/x83ftLtY_bigger.jpg,https://x.com/CamiloSamperZ/status/1841548397104271592,tweet_id:1841548397104271592
MotorPy.com,@motorpy,2024-09-30T17:30:02.000Z,False,Volvo aumenta flota de autobuses en Brasilia Transporte público https://motorpy.com/volvo-aumenta-flota-de-autobuses-en-brasilia-transporte-publico/…,0,0,0,54,[],[],[],https://pbs.twimg.com/profile_images/516314034748915712/_jdsCcMw_bigger.png,https://x.com/motorpy/status/1840806321953649006,tweet_id:1840806321953649006
Milton Gonçalves,@EdiBrasili,2024-08-28T21:12:22.000Z,False,100 DIAS DE GOVERNO| Marcus Vinicius quer resolver o problema do transporte público em Valparaíso https://edibrasilia.com.br/politica-do-entorno/100-dias-de-governo-marcus-vinicius-quer-resolver-o-problema-do-transporte-publico-em-valparaiso/… via  É di Brasília,0,0,0,35,[],['@Portal'],[],https://pbs.twimg.com/profile_images/1382221797278507009/swa1Rpzj_bigger.jpg,https://x.com/EdiBrasili/status/1828903474051875018,tweet_id:1828903474051875018
CAMPOS OFERTAS.,@luizparanoa,2024-08-27T12:29:53.000Z,False,"Alguém sabe se Brasília o subsídio é por pessoa ou viagem, pq se for por pessoa explica muita coisa do transporte público da capital.",0,0,2,33,[],[],[],https://pbs.twimg.com/profile_images/1836384526601207808/BTYclk-3_bigger.jpg,https://x.com/luizparanoa/status/1828409598790729815,tweet_id:1828409598790729815
MyTransit São Paulo,@MyTransitSP,2024-08-26T21:44:19.000Z,False,Distrito Federal reforça transporte público na região norte de Brasília com entrega de 25 novos ônibus : https://diariodotransporte.com.br/2024/08/26/distrito-federal-reforca-transporte-publico-na-regiao-norte-de-brasilia-com-entrega-de-25-novos-onibus/… | #SãoPaulo #Transit #MetroSP #CPTM #ViaQuatro #ViaMobilidade,0,0,0,33,"['#SãoPaulo', '#Transit', '#MetroSP', '#CPTM', '#ViaQuatro', '#ViaMobilidade']",[],[],https://pbs.twimg.com/profile_images/1287551215644090369/EsG75ig0_bigger.jpg,https://x.com/MyTransitSP/status/1828186739380240805,tweet_id:1828186739380240805
Agência Brasília,@AgenciaBrasilia,2024-08-25T19:35:47.000Z,False," Mais conforto e segurança para os usuários de transporte público. O DF recebeu 90 novos ônibus para o BRT do Gama e de Santa Maria, sem impacto na tarifa. Com tecnologia moderna, os novos modelos contribuem para a qualidade do ar e a preservação do meio ambiente.",1,0,1,243,[],[],['\\U0001f68d'],https://pbs.twimg.com/profile_images/1587505169117347840/sjjvwZ7v_bigger.jpg,https://x.com/AgenciaBrasilia/status/1827792005314884013,tweet_id:1827792005314884013
Ferreira,@ferrreiracom3r,2024-08-24T17:09:51.000Z,False,É muita inocência achar que Brasília um dia vai investir em transporte público kkkk,0,0,0,26,[],[],[],https://pbs.twimg.com/profile_images/1901006596353798146/ZrdYo-Cd_bigger.jpg,https://x.com/ferrreiracom3r/status/1827392891225801125,tweet_id:1827392891225801125
Ícarus,@SirIcarus_,2024-08-23T17:13:45.000Z,False,Depender de transporte público e no máximo Uber em Brasília é triste demais,0,0,0,14,[],[],[],https://pbs.twimg.com/profile_images/1641602255584362499/XxlE8ScE_bigger.jpg,https://x.com/SirIcarus_/status/1827031485443866935,tweet_id:1827031485443866935
Antonieta,@an68657601,2024-08-23T14:29:05.000Z,False,"Amr se fosse só SP tava bom
Passei 2 meses trabalhando em Brasilia e o trânsito era desesperador
E pra piorar lá nem tem a frota de transporte público que tem aí em SP",0,0,1,76,[],[],[],https://pbs.twimg.com/profile_images/1864019697852686336/MY-XvzwV_bigger.jpg,https://x.com/an68657601/status/1826990045544272114,tweet_id:1826990045544272114
Igor Costa,@costarigor,2024-08-22T19:21:47.000Z,False,"Td vez que preciso usar transporte público em Brasília, amaldiçoo cada governador, secretário de transporte e de mobilidade, em ordem de eleição. Malditos!",0,0,2,52,[],[],[],https://pbs.twimg.com/profile_images/1469376720788672514/KvA4AGDN_bigger.jpg,https://x.com/costarigor/status/1826701317185970469,tweet_id:1826701317185970469
Mateus Oliveira,@mateusno,2024-08-22T13:27:22.000Z,False,"Em Brasília é praticamente obrigatório… Apesar das inúmeras obras do GDF, só me lembro de 2 focadas em transporte público e por conta do PAC: expansão do metrô para regiões que já eram cruzadas pelo trilho e o BRT no setor policial/W3.",0,0,5,539,[],[],[],https://pbs.twimg.com/profile_images/1685310813513338880/LuaIFUln_bigger.jpg,https://x.com/mateusno/status/1826612124875194686,tweet_id:1826612124875194686
Agência Brasília,@AgenciaBrasilia,2024-08-22T13:14:37.000Z,False, Mais conforto e segurança para os passageiros do transporte público do DF: 90 novos ônibus - 51 articulados e 39 Padron - vão circular no BRT do Gama e de Santa Maria. A renovação faz parte dos 195 ônibus anunciados pela Viação Pioneira em 2023.,1,0,1,136,[],[],['\\U0001f68c'],https://pbs.twimg.com/profile_images/1587505169117347840/sjjvwZ7v_bigger.jpg,https://x.com/AgenciaBrasilia/status/1826608918006505479,tweet_id:1826608918006505479
mabel,@Ma_bels,2024-08-22T10:54:09.000Z,False,"o transporte público de Brasília é tão patético q eu, morando no plano piloto, tenho que sair 1h antes de casa se quiser chegar na hora na unb, sendo que a rota de carro demora de 20 a 30 min.",0,0,0,28,[],[],[],https://pbs.twimg.com/profile_images/1749937732229505024/v_WetRi2_bigger.jpg,https://x.com/Ma_bels/status/1826573569020625223,tweet_id:1826573569020625223
